ball_num,comment,datetime
4.3,"Starc to Vijay, no run, Vijay is beaten on the outside edge and still manages to smile looking at the face of Starc. The left-armer hurled it fuller and drew the right-hander into a drive. Vijay chased it for a drive and the ball whizzed past the outside edge","Dec 17, 2018 12:26:38 PM"
4.2,"Starc to Vijay, no run, away-angler outside off at <b>145.1kph </b> and Vijay shoulders arms. A stare follows from the bowler","Dec 17, 2018 12:25:55 PM"
4.1,"Starc to Vijay, no run, 141.4kph, swings in a bit does this length ball, Vijay defends down the pitch","Dec 17, 2018 12:25:14 PM"
3.6,"Hazlewood to Kohli, no run, short ball angled down leg, Kohli walks across and bends forward to let it go","Dec 17, 2018 12:24:24 PM"
3.5,"Hazlewood to Pujara, <b>out</b> Caught by Paine!! <b>Two down!</b> Australia have managed to dismiss Pujara quickly - which has been a rarity this series. <i>Over to Kohli, now?</i> Once again, there's extra bounce on this back of a length delivery which seamed away off the deck around the fifth/sixth stump line. Pujara is lured to stick his bat out with no feet movement and the ball brushes his glove before settling into the keeper's mitts. Australia know the value of this wicket. <b>Pujara c Paine b Hazlewood 4(11) [4s-1]</b>","Dec 17, 2018 12:22:14 PM"
3.4,"Hazlewood to Pujara, no run, 138.6kph, extra bounce on this short of length delivery, Pujara does well to adjust that and drops it adjacent to the pitch on the off-side with soft hands","Dec 17, 2018 12:21:27 PM"
3.3,"Hazlewood to Pujara, no run, moving away off the deck at 139.7kph, too wide and Pujara is content in letting that go","Dec 17, 2018 12:20:48 PM"
3.2,"Hazlewood to Pujara, no run, Hazlewood shortens his length, Pujara defends on the off-side","Dec 17, 2018 12:20:10 PM"
3.1,"Hazlewood to Pujara, <b>FOUR</b>, 140.9kph, fullish ball, seamed away a bit and Pujara was half-forward to block, was playing with soft hands and hence the ball rolls all along the ground. Past the cordon and into the third man fence","Dec 17, 2018 12:19:34 PM"
2.6,"Starc to Vijay, no run, sharp bumper at <b>149.3kph,</b> just down leg and Vijay half-ducks under it. Starc has a word or two with the batsman and Vijay replies along with a smile","Dec 17, 2018 12:18:36 PM"
2.5,"Starc to Vijay, <b>FOUR</b>, Starc hurls it full outside off and Vijay drives off the front foot with an opened bat-face. Places it well wide of the gully fielder. The new ball bullets away to the fence","Dec 17, 2018 12:17:51 PM"
2.4,"Starc to Vijay, no run, 141.5kph, back of a length delivery just outside off, Vijay hops and angles it to backward point","Dec 17, 2018 12:17:07 PM"
2.3,"Starc to Vijay, no run, slanted across the right-hander, Vijay lets it go","Dec 17, 2018 12:16:26 PM"
2.2,"Starc to Vijay, byes, <b>FOUR</b>, that just took off from a length, was well outside off and Vijay shouldered arms. Paine leapt full-length to his left, but the ball just kept going. Must have hit a crack","Dec 17, 2018 12:15:48 PM"
2.1,"Starc to Vijay, no run, good length ball angled across outside off, a watchful leave from Vijay follows","Dec 17, 2018 12:14:58 PM"
1.6,"Hazlewood to Pujara, no run, 134.9kph, shortish ball just outside off, Pujara rides the bounce and drops it into the off-side","Dec 17, 2018 12:14:06 PM"
1.5,"Hazlewood to Pujara, no run, Hazlewood shortens his length and gets it shape away from the right-hander, but the line is too wide outside off, nothing doing from Pujara","Dec 17, 2018 12:13:28 PM"
1.4,"Hazlewood to Pujara, no run, harmless length ball wide of off, left alone","Dec 17, 2018 12:12:50 PM"
1.3,"Hazlewood to Pujara, no run, Pujara has been hit on the glove. Seam-up delivery, hit the deck on a length and reared up more than Pujara would have wanted it to. He was looking to work it through the leg-side and got rapped on the bottom hand, which came off the bat immediately after the impact","Dec 17, 2018 12:12:11 PM"
1.2,"Hazlewood to Vijay, 1 run, Vijay gets off the mark, tucks this rib-tickler to fine leg","Dec 17, 2018 12:11:37 PM"
1.1,"Hazlewood to Vijay, no run, back of a length delivery around the off-stump line, Vijay hops across and taps it towards point","Dec 17, 2018 12:10:55 PM"
0.6,"Starc to Pujara, no run, 143.9kph, short of a good length ball closer to off, but Pujara is happy to let it pass. <b>A wicket-maiden</b> from Starc who gives a stare to the batsman","Dec 17, 2018 12:09:51 PM"
0.5,"Starc to Pujara, no run, pacy length ball wide of off, left alone","Dec 17, 2018 12:09:12 PM"
0.4,"Starc to Rahul, <b>out</b> Bowled!! Bowled him! Starc is pumped up. He was uncertain - the Indian opener. Hint of inswing for Starc from a length and Rahul was in two minds - whether to play or leave. Chose the latter, but was too late to withdraw his bat. The ball hits the bat and deflects onto the stumps. Ideal start for Australia! Had there been no bat, the ball would have gone straight to the keeper. <b>Rahul b Starc 0(4)</b>","Dec 17, 2018 12:07:03 PM"
0.3,"Starc to Rahul, no run, back of a length delivery at 143.2kph, left alone on line","Dec 17, 2018 12:06:18 PM"
0.2,"Starc to Rahul, no run, Starc darts it fuller, but sprays it well outside off, left alone","Dec 17, 2018 12:05:30 PM"
0.1,"Starc to Rahul, no run, tentative poke from Rahul away from his body. Limited feet movement from Rahul as he goes for the push against this fullish ball at 142.8kph, <b>past the outside edge</b>","Dec 17, 2018 12:04:55 PM"
93.2,"Bumrah to Starc, <b>out</b> Bowled!! Bumrah hits the timber! <b>India need 287 runs to go 2-0 up.</b> Jasprit Bumrah kept it simple, from round the wicket bowled a good length ball, a backing away Starc played all around it and the ball hit the top of off. Hazlewood and Starc - Australia's new ball bowlers - sprint away to the dressing room. <b>Starc b Bumrah 14(29) [4s-3]</b>","Dec 17, 2018 11:54:25 AM"
93.1,"Bumrah to Hazlewood, 1 run, no yorker, yet! A backing away Hazlewood taps this back of a length delivery to backward point","Dec 17, 2018 11:53:54 AM"
92.6,"U Yadav to Starc, <b>FOUR</b>, edged, finds the gap in the cordon and goes away for a four, despite a desperate dive from Bumrah. Umesh Yadav induced the outside edge with this short of length delivery outside off as Starc pushed hard at it. Beats a diving Kohli to his left at slip. <b>35 is the partnership now</b>","Dec 17, 2018 11:52:30 AM"
92.5,"U Yadav to Hazlewood, 1 run, Hazlewood was slightly cramped for room, but Hazlewood does well to scythe it one-handed through point","Dec 17, 2018 11:51:49 AM"
92.4,"U Yadav to Hazlewood, no run, pounds this on a short of length and Hazlewood taps it into the off-side","Dec 17, 2018 11:51:11 AM"
92.4,"U Yadav to Hazlewood, <b>wide</b>, sharp bumper, Hazlewood moves further leg-side and bends backwards to let it go. Wided for height","Dec 17, 2018 11:50:38 AM"
92.3,"U Yadav to Hazlewood, no run, 133.3kph shortish ball on the stumps, Hazlewood stays leg-side and defends it into the pitch","Dec 17, 2018 11:50:01 AM"
92.2,"U Yadav to Starc, 1 run, just a tap into the off-side with soft hands after riding the bounce and off they go for a sharp single. Superb running","Dec 17, 2018 11:49:35 AM"
92.1,"U Yadav to Hazlewood, 3 runs, back of a length delivery outside off, loads of room outside off, Hazlewood hangs back and has a slash at it. Didn't quite middle it and one hand came off the handle after the impact. Three more to the tally as the ball rolls to deep point","Dec 17, 2018 11:48:56 AM"
91.6,"Ishant to Starc, no run, 132.2kph, back of a length delivery just outside off, Starc sticks his bat out and connects with thin air as the ball deflects away off the deck","Dec 17, 2018 11:47:34 AM"
91.5,"Ishant to Hazlewood, 1 run, taps this fuller length ball towards cover-point and hares to the other end. Hazlewood was backing away. Partnership: <b>quarter century</b>","Dec 17, 2018 11:46:49 AM"
91.4,"Ishant to Hazlewood, no run, shorter and closer to the sticks, Hazlewood crouches and moves away from it. A beaming smile on Starc's face at the other end","Dec 17, 2018 11:46:00 AM"
91.3,"Ishant to Hazlewood, <b>FOUR</b>, ""these are priceless runs for Australia,"" says SunnyG on air. Once again, Hazlewood hangs back, arches his back and uses the bowler's pace and width to angle it backward of backward point","Dec 17, 2018 11:45:10 AM"
91.2,"Ishant to Hazlewood, no run, fuller ball and attacking the sticks, Hazlewood goes for the drive and inside-edges it to mid-on","Dec 17, 2018 11:44:29 AM"
91.1,"Ishant to Hazlewood, no run, full and going away at 134.2kph, Hazlewood pushes and gets beaten on the outside edge","Dec 17, 2018 11:43:50 AM"
90.6,"Shami to Starc, <b>FOUR</b>, full on the pads and Starc takes heavy toll of it. No feet movement, but Starc uses his wrists to flick it away behind square on the leg-side. The man in the deep was too fine. The final wicket partnership is now worth 20 runs","Dec 17, 2018 11:42:42 AM"
90.5,"Shami to Starc, no run, away-seaming back of a length delivery, Starc stands tall and has a waft at it, fails to make contact","Dec 17, 2018 11:42:02 AM"
90.4,"Shami to Hazlewood, 1 run, tad fuller and induces the outside edge of Hazlewood who plays away from the body. Falls short of the gully fielder, who couldn't stop it cleanly - courtesy an awkward bounce","Dec 17, 2018 11:41:23 AM"
90.3,"Shami to Hazlewood, no run, better from Shami. On a good length around the fifth/sixth stump line, Hazlewood pokes and misses","Dec 17, 2018 11:40:40 AM"
90.2,"Shami to Hazlewood, <b>FOUR</b>, wow! That's a good shot from the No. 11. Stays leg-side of the ball and arches his back to nicely steer this shortish ball through backward point. Got it off the middle","Dec 17, 2018 11:40:02 AM"
90.1,"Shami to Hazlewood, no run, another play and a miss! Length ball decking away, Hazlewood drives sans any feet movement and misses","Dec 17, 2018 11:39:44 AM"
89.6,"Ishant to Starc, byes, <b>FOUR</b>, loose from Ishant Sharma, handy runs for Australia. Darts a length ball way down leg and Pant can't even get close to it despite a dive. Misses everyone and runs away to the fence","Dec 17, 2018 11:38:46 AM"
89.5,"Ishant to Starc, no run, seaming away from a length, Starc backs away and has a push at it, once again misses the outside nick","Dec 17, 2018 11:37:54 AM"
89.4,"Ishant to Starc, no run, short ball wide of off, Starc ignores","Dec 17, 2018 11:37:15 AM"
89.3,"Ishant to Starc, no run, Starc stays leg-side of the ball and pokes at this short of length delivery just outside off, beaten on the outside edge","Dec 17, 2018 11:36:38 AM"
89.2,"Ishant to Hazlewood, 1 run, loud applause for a single. Hazlewood moves leg-side and guides this back of a length delivery to third man","Dec 17, 2018 11:36:04 AM"
89.1,"Ishant to Hazlewood, no run, shortish delivery at 131.5kph, a backing away Hazlewood defends it on the off-side","Dec 17, 2018 11:35:34 AM"
88.6,"Shami to Starc, <b>FOUR</b>, backs away does Starc and thwacks the ball over mid-off for a four. Did not time it but got enough wood on it to send it away. Aussies will take it with open arms","Dec 17, 2018 11:31:25 AM"
88.5,"Shami to Hazlewood, 1 run, backs away and clumsily taps the ball out into the off-side for a single. Hazlewood was all over the place trying to fend that","Dec 17, 2018 11:30:51 AM"
88.4,"Shami to Hazlewood, no run, looks to throw his bat outside off and misses","Dec 17, 2018 11:30:02 AM"
88.3,"Shami to Hazlewood, no run, backs away and looks to punch it, misses","Dec 17, 2018 11:29:24 AM"
88.2,"Shami to Starc, 1 run, banged in and has been nudged away into the on-side off the back foot for a single","Dec 17, 2018 11:28:52 AM"
88.1,"Shami to Starc, no run, pings in the short ball outside off and has been left alone","Dec 17, 2018 11:28:07 AM"
87.6,"Bumrah to Hazlewood, no run, Hazlewood hangs back and pushes the ball out into the off-side","Dec 17, 2018 11:26:53 AM"
87.5,"Bumrah to Hazlewood, no run, the fiesty yorker! Hazlewood stays rooted in his crease and digs the ball out into the on-side","Dec 17, 2018 11:26:21 AM"
87.4,"Bumrah to Hazlewood, no run, the short ball dished out and Hazlewood had enough time to sit under it","Dec 17, 2018 11:25:52 AM"
87.3,"Bumrah to Hazlewood, no run, backs away again and taps the back of a length delivery into the off-side","Dec 17, 2018 11:25:17 AM"
87.2,"Bumrah to Hazlewood, no run, another glorious drive attempted outside off and has been missed","Dec 17, 2018 11:24:46 AM"
87.1,"Bumrah to Hazlewood, no run, looks to back away and punch it, misses","Dec 17, 2018 11:24:16 AM"
86.6,"Shami to Starc, no run, bangs the ball in again and Starc meets it with a duck followed by a smile. Is it also a hint that my time will come?","Dec 17, 2018 11:23:15 AM"
86.5,"Shami to Lyon, <b>out</b> Caught by Hanuma Vihari!! And the blow on to the helmet the previous ball has worked. After the boundary on the first ball, Kohli had a deep point in place. Shami banged it in again and Lyon backed away to slice it. And guess what? The man positioned at deep point comes in and takes an easy catch. <b>Shami has a 6-fer now. Career best figures for him.</b> <b>Lyon c Hanuma Vihari b Shami 5(10) [4s-1]</b>","Dec 17, 2018 11:21:32 AM"
86.4,"Shami to Lyon, no run, that was venomous! Gosh. The sound the ball made when it jammed into the helmet was scary. Shami had not liked the cut shot played earlier in the over and banged it in. Lyon was backing away again but Shami went for the head this time and pinged the helmet. The Indian players, led by Kohli, checked on Lyon who seems to be ok. But as per the formalities in case of a blow to the helmet, the physio is out there checking on him","Dec 17, 2018 11:17:14 AM"
86.3,"Shami to Lyon, no run, fuller ball and has been toe-ended into the off-side. The man at mid-off picks the ball up","Dec 17, 2018 11:16:32 AM"
86.2,"Shami to Lyon, no run, looks to do the same thing again and misses. That darted in a bit from a shorter length and Lyon was backing away but missed the cut","Dec 17, 2018 11:15:57 AM"
86.1,"Shami to Lyon, <b>FOUR</b>, short ball, Lyon throws his bat at it and swords the ball over point for a four. Never tried to keep it down","Dec 17, 2018 11:15:24 AM"
85.6,"Bumrah to Starc, no run, looks to back away awkwardly and punch it, misses. Bumrah continues to be the tireless assassin","Dec 17, 2018 11:14:14 AM"
85.5,"Bumrah to Starc, no run, and again, the bigggggggg heave and miss","Dec 17, 2018 11:13:40 AM"
85.4,"Bumrah to Starc, no run, Starc seems to be saving his fingers for the moment. That was pinged in short, it angled in and Starc danced back to poke and miss it. Not at all getting in line with the ball","Dec 17, 2018 11:13:10 AM"
85.3,"Bumrah to Starc, no run, shorter delivery outside off and has been left alone","Dec 17, 2018 11:12:40 AM"
85.2,"Bumrah to Lyon, 1 run, stays behind the line of the ball this time and tucks it behind square for a single","Dec 17, 2018 11:11:52 AM"
85.1,"Bumrah to Lyon, no run, goes for the big heave and misses. Tried hoicking it across the line","Dec 17, 2018 11:11:16 AM"
84.6,"Shami to Starc, no run, poky attempt from the crease sans any feet and it again beats the outer edge","Dec 17, 2018 11:10:20 AM"
84.5,"Shami to Starc, no run, looks to throw his bat at another wide ball and misses. Did not miss the outer edge by much","Dec 17, 2018 11:09:42 AM"
84.4,"Shami to Starc, no run, he is just toying with the swing here. This time gets the ball go away and Starc comes up with a tame poke which misses the ball by a mile","Dec 17, 2018 11:09:08 AM"
84.3,"Shami to Starc, no run, stabs the ball outside off and the ball dies down after kissing the turf. It was in the vicinity of the sticks but Starc was all aware of the whereabouts of the ball","Dec 17, 2018 11:08:30 AM"
84.2,"Shami to Starc, no run, Starc does not want to get in line with the ball there. Looks to throw his bat at it and misses","Dec 17, 2018 11:07:47 AM"
84.1,"Shami to Starc, no run, bangs the ball in short and Starc sways away from it","Dec 17, 2018 11:07:20 AM"
83.6,"Bumrah to Lyon, leg byes, <b>FOUR</b>, that was a wild delivery. Misses the yorker again and strays on to the pads. Lyon misses the leg-sidish swish but gets the pad to make contact and send the ball past the dive of Pant for a four","Dec 17, 2018 11:06:20 AM"
83.5,"Bumrah to Lyon, no run, low full toss outside off and swung away to beat the push drive. The bowler I guess went for the yorker and missed his mark","Dec 17, 2018 11:05:35 AM"
83.4,"Bumrah to Lyon, no run, gets sucked into a full and wide ball, beaten","Dec 17, 2018 11:04:59 AM"
83.3,"Bumrah to Pat Cummins, <b>out</b> Bowled!! And the low bounce comes into play now. Pat Cummins looks to stand up to the short of length ball but the ball keeps perilously low for the woodwork to be shattered. Pat Cummins had no chance. No batsman stood a chance against that beastly act from the deck. The demons in the wicket have woken up. They have the batsman under a spell for the moment being. First the barrage of bouncers and now the roll of the dice. <b>Pat Cummins b Bumrah 1(6)</b>","Dec 17, 2018 11:02:35 AM"
83.2,"Bumrah to Pat Cummins, no run, gosh! This is unplayable. The batsman is squared up and the ball flies past the outer edge","Dec 17, 2018 11:01:58 AM"
83.1,"Bumrah to Pat Cummins, no run, bangs the ball in and Pat Cummins ducks under it","Dec 17, 2018 11:01:30 AM"
82.6,"Shami to Starc, no run, fuller and luring, Starc throws the kitchen sink and also the pile of utensils on top of it but only gets a whiff of air in the bargain","Dec 17, 2018 11:00:21 AM"
82.5,"Shami to Starc, no run, what a take from Pant! He leapt up like a leopard would on its prey. That too one handed. The left one. Banged in short and the ball kept climbing after it passed the batsman to test the keeper","Dec 17, 2018 10:59:40 AM"
82.4,"Shami to Starc, no run, fuller and wider, that was the sucker delivery and Starc throws his bat at it to miss it","Dec 17, 2018 10:58:54 AM"
82.3,"Shami to Starc, no run, happy to play the short ball well inside the line of the ball","Dec 17, 2018 10:58:07 AM"
82.2,"Shami to Starc, no run, was that a bird or a kite? Flies away well outside off for the keeper to apply the brakes by pouching it","Dec 17, 2018 10:57:36 AM"
82.1,"Shami to Khawaja, <b>out</b> Caught by Pant!! Bumps in the short ball and the perfume ball has spread its aroma all over the southpaw. Khawaja looks to fend that short ball from round the wicket and got a faint tickle off the glove for Pant to take it. India are amongst the wickets all of a sudden after a quiet first session. Brute of a ball though. The angle into him ensured he had to play at it and the dangling prod outside off did not help as that might have straightened a bit as well to force the batsman into a reverse C. <b>Khawaja c Pant b Shami 72(213) [4s-5]</b>","Dec 17, 2018 10:55:13 AM"
82.1,"Shami to Khawaja, <b>wide</b>, Shami continues with his bumper ploy. This was wide of off and it was too high as well","Dec 17, 2018 10:54:24 AM"
81.6,"Bumrah to Pat Cummins, no run, that slips out of his hand and the umpire also deemed it below the waist height. The batsman was taken aback by it and missed it","Dec 17, 2018 10:53:24 AM"
81.5,"Bumrah to Khawaja, 1 run, bangs the ball in. Cramps the batsman for room and Khawaja was late on the pull. Gets it away into the on-side for a single","Dec 17, 2018 10:52:27 AM"
81.4,"Bumrah to Khawaja, no run, and again, angles in from round the wicket and has been left alone","Dec 17, 2018 10:51:45 AM"
81.3,"Bumrah to Khawaja, no run, shoulders arms to a delivery decking from outside off","Dec 17, 2018 10:51:12 AM"
81.2,"Bumrah to Khawaja, no run, fuller ball and has been yorked out into the off-side","Dec 17, 2018 10:50:39 AM"
81.1,"Bumrah to Khawaja, no run, stays behind the line of the ball and blocks it","Dec 17, 2018 10:50:06 AM"
80.6,"Shami to Pat Cummins, no run, another body blow. Literally. That was banged in and Pat Cummins was trying to duck but got into a tangle and the ball thrusted into his arm. Does not flinch though","Dec 17, 2018 10:48:41 AM"
80.5,"Shami to Khawaja, 3 runs, leans into the drive and crisps the drive through the covers for a triple","Dec 17, 2018 10:48:01 AM"
80.4,"Shami to Khawaja, no run, length delivery decking in and has been stabbed back to the bowler","Dec 17, 2018 10:47:07 AM"
80.3,"Shami to Khawaja, no run, sharp in-ducker and has been turned away into the mid-wicket region","Dec 17, 2018 10:46:31 AM"
80.2,"Shami to Khawaja, no run, bangs it in outside off and Khawaja ignores that","Dec 17, 2018 10:45:49 AM"
80.1,"Shami to Pat Cummins, 1 run, length delivery zoning around the off-stump and has been stabbed out into the off-side for a single. Gets off the mark and ensures Shami does not get the hat-trick as well","Dec 17, 2018 10:44:54 AM"
79.6,"Bumrah to Khawaja, no run, length delivery and has been blocked out into the off-side","Dec 17, 2018 10:43:26 AM"
79.5,"Bumrah to Khawaja, no run, shorter ball, skids on and Khawaja is late on the pull. And also I think he chose the wrong length as well. Don't think it was that short","Dec 17, 2018 10:42:55 AM"
79.4,"Bumrah to Khawaja, no run, little bit of swing and seam still available. This time closer to the sticks and Khawaja sees the line before letting it go. Khawaja is the key from here on","Dec 17, 2018 10:42:20 AM"
79.3,"Bumrah to Khawaja, no run, fuller ball and has been push driven away to mid-on","Dec 17, 2018 10:41:50 AM"
79.2,"Bumrah to Khawaja, no run, stays behind the line of the ball and pushes it away into the off-side","Dec 17, 2018 10:41:18 AM"
79.1,"Bumrah to Khawaja, no run, and almost another wicket..fuller ball outside off and lures the batsman into a push drive. Beaten outside off","Dec 17, 2018 10:40:53 AM"
78.6,"Shami to Finch, <b>out</b> Caught by Pant!! That is another one down. The short ball does the trick again. The perfume ball goes a little down leg and Finch fails to get his glove out of the way. Pant behind the sticks takes it easily to his left. Shami is on a hat-trick. That was another very well directed bouncer and more importantly at a height that the batsman can't ignore or duck. <b>Finch c Pant b Shami 25(31) [4s-5]</b>","Dec 17, 2018 10:38:59 AM"
78.5,"Shami to Paine, <b>out</b> Caught by Kohli!! That is one heck of a delivery. Climbs up on to the throat of the batsman, who leapt up in the air thanks to the disconcerting bounce and ended up gloving it. The ball lobbed up and Kohli at second slip took an easy catch. India finally manage a breakthrough but it has taken a lot of time for that to come. <b>Paine c Kohli b Shami 37(116) [4s-4]</b>","Dec 17, 2018 10:36:31 AM"
78.5,"Shami to Paine, <b>wide</b>, bangs the ball in short and it goes over the head of the batsman for it to be wided","Dec 17, 2018 10:35:47 AM"
78.4,"Shami to Paine, no run, little fuller and angling in, Paine lets it go outside off","Dec 17, 2018 10:34:53 AM"
78.3,"Shami to Paine, no run, taps the ball away into the covers off the back foot","Dec 17, 2018 10:34:15 AM"
78.2,"Shami to Khawaja, 1 run, angles the ball in and Khawaja tucks the ball away into the on-side for a quick single","Dec 17, 2018 10:33:35 AM"
78.1,"Shami to Khawaja, no run, length delivery dangling in and has been pushed away into the off-side","Dec 17, 2018 10:32:57 AM"
77.6,"Ishant to Paine, no run, defended and that will be <b>lunch</b>","Dec 17, 2018 9:53:15 AM"
77.5,"Ishant to Paine, no run, oh in the air but wide of short mid-wicket, fullish delivery on the leg stump, looked like the leg-cutter, Paine mistimed the flick, leading edge didn't go to hand luckily","Dec 17, 2018 9:52:44 AM"
77.4,"Ishant to Khawaja, 1 run, too straight and Khawaja tickles it to fine leg","Dec 17, 2018 9:51:34 AM"
77.3,"Ishant to Khawaja, no run, moves across to this fullish ball and flicks to mid-wicket","Dec 17, 2018 9:50:52 AM"
77.2,"Ishant to Khawaja, no run, full and outside off stump, Khawaja lets it go","Dec 17, 2018 9:50:13 AM"
77.1,"Ishant to Khawaja, no run, good length delivery outside off stump, Khawaja lets it go","Dec 17, 2018 9:49:19 AM"
76.6,"Shami to Paine, no run, full in length and outside off stump, Paine covers the stumps and lets it go","Dec 17, 2018 9:47:57 AM"
76.5,"Shami to Paine, no run, defended off the back foot to cover","Dec 17, 2018 9:47:20 AM"
76.4,"Shami to Paine, no run, short delivery outside off stump, Paine drops his wrists and lets it go","Dec 17, 2018 9:46:41 AM"
76.3,"Shami to Paine, no run, full delivery outside off stump, Paine defends to mid-off","Dec 17, 2018 9:46:07 AM"
76.2,"Shami to Paine, no run, short of length delivery on the off stump, Paine defends off the back foot","Dec 17, 2018 9:45:30 AM"
76.1,"Shami to Khawaja, 1 run, defended to backward point for a run","Dec 17, 2018 9:44:51 AM"
75.6,"Hanuma Vihari to Paine, no run, another one that's very wide, ignored","Dec 17, 2018 9:43:52 AM"
75.5,"Hanuma Vihari to Paine, no run, defended off the back foot","Dec 17, 2018 9:43:39 AM"
75.4,"Hanuma Vihari to Paine, no run, now the line is a little closer to the off stump, Paine lets it go","Dec 17, 2018 9:43:24 AM"
75.3,"Hanuma Vihari to Paine, <b>FOUR</b>, can't bowl full and wide outside off stump without deep cover, Paine reaches out and drills it hard along the ground","Dec 17, 2018 9:42:52 AM"
75.2,"Hanuma Vihari to Khawaja, 1 run, very full, driven to long-off","Dec 17, 2018 9:42:28 AM"
75.1,"Hanuma Vihari to Paine, 1 run, full and wide outside off stump, Paine drives it to sweeper cover","Dec 17, 2018 9:41:57 AM"
74.6,"Shami to Khawaja, no run, good length delivery on the off stump, Khawaja defends it towards cover","Dec 17, 2018 9:41:06 AM"
74.5,"Shami to Khawaja, no run, covers the stumps and lets this length ball go","Dec 17, 2018 9:40:24 AM"
74.4,"Shami to Khawaja, no run, full delivery outside off stump, Khawaja lets it go","Dec 17, 2018 9:39:43 AM"
